{
  "$schema": "../../public/schema/v1.json",
  "name": "Test JS Summit 2023",
  "description": "TestJS Summit is a 2-day conference discussing all things JS testing. The event is going to gather QAs and developers in-person.",
  "startDate": "2023-12-07",
  "location": "Hybrid",
  "url": "https://testjssummit.com/",
  "tags": ["JavaScript", "Testing"],
  "speakers": {
    "total": 31,
    "womenAndNonBinary": 10
  },
  "organizer": {
    "name": "GitNation"
  }
}
