{
  "$schema": "../../public/schema/v1.json",
  "name": "React Day Berlin 2023",
  "description": "React Day Berlin is your gateway to new opportunities and exciting collaboration on stellar tech. Attend in-depth talks, supercharge your hard and soft skills with career-boosting workshops, and connect with React enthusiasts.",
  "startDate": "2023-12-08",
  "location": "Hybrid",
  "url": "https://reactday.berlin/",
  "tags": [
    "JavaScript",
    "React",
    "React Native"
  ],
  "speakers": {
    "total": 56,
    "womenAndNonBinary": 5
  },
  "organizer": {
    "name": "GitNation"
  }
}