{
  "$schema": "../../public/schema/v1.json",
  "name": "BeJS 2023",
  "description": "A family-like, community-run JavaScript Conference!",
  "startDate": "2023-05-12",
  "location": "Brussels, Belgium",
  "url": "https://www.bejs.io/conf",
  "tags": [
    "JavaScript"
  ],
  "speakers": {
    "total": 19,
    "womenAndNonBinary": 8
  },
  "organizer": {
    "name": "BeJS"
  }
}
