{
	"$schema": "../../../public/schema/v1.json",
	"name": "NG Belgrade Conf",
	"description": "NG Belgrade Conf 2024 is the largest Angular conference in the Balkans.",
	"startDate": "2023-11-4",
	"location": "Belgrade, Serbia",
	"url": "https://angularbelgrade.org/",
	"tags": ["JavaScript", "Angular"],
	"speakers": {
		"total": 7,
		"womenAndNonBinary": 1
	},
	"organizer": {
		"name": "Angular Belgrade"
	}
}
