{
	"$schema": "../../../public/schema/v1.json",
	"name": "JSConf Colombia",
	"description": "JSConf Colombia is not just a conference; it's a celebration. One that is a testament to the power of unity, knowledge, and passion. So, let's make this farewell party unforgettable.",
	"startDate": "2023-11-17",
	"location": "Medell√≠n, Colombia",
	"url": "https://www.jsconf.co/",
	"tags": ["JavaScript"],
	"speakers": {
		"total": 25,
		"womenAndNonBinary": 7
	},
	"organizer": {
		"name": "JSConf Colombia Crew"
	}
}
