{
  "$schema": "../../public/schema/v1.json",
  "name": "React Day Berlin 2023",
  "description": "NodeConf EU brings together the brightest minds in the Node.js community.",
  "startDate": "2023-11-06",
  "location": "Kilkenny, Ireland",
  "url": "https://testjssummit.com/",
  "tags": ["JavaScript", "Testing"],
  "speakers": {
    "total": 38,
    "womenAndNonBinary": 5
  },
  "organizer": {
    "name": "NearForm",
    "url": "https://www.nearform.com/",
    "forProfit": true
  },
  "social": {
    "twitter": "NodeConfEU"
  }
}
